{
  "provider_id": "reference-local-structured-extraction-high",
  "display_name": "Reference Local Structured Extraction High",
  "description": "Primary high-quality binding for the M30 local structured extraction reference stack.",
  "provider_kind": "managed_model_service",
  "service_dependency_ids": [
    "reference-local-ai-extraction"
  ],
  "capability_tags": [
    "extraction_reference_stack",
    "local_only",
    "sensitive_data_approved",
    "structured_output",
    "text_generation"
  ],
  "model_identifiers": [
    "reference-local-structured-extraction-high-v1"
  ],
  "tool_identifiers": [],
  "quality_tier": "high",
  "latency_tier": "interactive",
  "cost_tier": "medium",
  "determinism_tier": "high",
  "structured_output": {
    "mode": "json_schema",
    "schema_guarantee": "strict"
  },
  "policy_scope_tags": [
    "local_only",
    "sensitive_data_approved"
  ],
  "health_dependency_mode": "all_ready"
}
